employee_id,survey_month,support_feeling,job_satisfaction,exhaustion_feeling,work_mood,feedback_text,department,location,job_title,worker_type,tenure_months
865,2025-01,Often supported,Satisfied,Rarely,Happy,Proper equipment provided. Fair pay. Clear instructions. Safety concerns.,Pack House Operations,Citrusdal Pack House,Sorter,Permanent,54
866,2025-01,Often supported,Satisfied,Rarely,Neutral,Good communication. Good team. Clear instructions.,Maintenance,Graaff-Reinet,Mechanic,Permanent,120
868,2025-01,Sometimes supported,Neutral,Sometimes,Neutral,Regular breaks. Opportunities to learn. Inadequate breaks. Weather challenges.,Logistics,Citrusdal Pack House,Forklift Operator,Permanent,97
870,2025-01,Sometimes supported,Neutral,Rarely,Unhappy,Fair pay. Supportive supervisors. Poor communication. Weather challenges.,Maintenance,Graaff-Reinet,Mechanic,Permanent,54
872,2025-01,Rarely supported,Dissatisfied,Often,Very happy,Poor communication. Low wages. Housing problems.,Grape Production,Upington,Viticulturist,Seasonal,3
874,2025-01,Often supported,Satisfied,Sometimes,Unhappy,Fair management. Opportunities to learn. Fair pay.,Administration,Dullstroom,HR Assistant,Permanent,172
876,2025-01,Sometimes supported,Neutral,Sometimes,Very happy,Proper equipment provided. Good working environment. Transportation issues. Too much overtime.,Cattle Farming,Dullstroom,Livestock Supervisor,Permanent,71
878,2025-01,Sometimes supported,Neutral,Sometimes,Neutral,Clear instructions. Good working environment. Poor equipment. Weather challenges.,Cattle Farming,Dullstroom,Farm Hand,Contract,33
879,2025-01,Rarely supported,Dissatisfied,Often,Unhappy,Inadequate breaks. Housing problems. Too much overtime. Good team.,Administration,Dullstroom,Admin Clerk,Permanent,166
880,2025-01,Often supported,Satisfied,Sometimes,Happy,Good team. Respectful treatment. Safety is prioritized.,Maintenance,Ceres Pack House,Electrician,Permanent,142
882,2025-01,Sometimes supported,Neutral,Sometimes,Neutral,Respectful treatment. Proper equipment provided. Too much overtime. Poor communication.,Cattle Farming,Dullstroom,Livestock Supervisor,Permanent,85
887,2025-01,Sometimes supported,Neutral,Sometimes,Happy,Safety is prioritized. Respectful treatment. Poor equipment. Long hours.,Cattle Farming,Dullstroom,Animal Care Specialist,Contract,2
888,2025-01,Rarely supported,Dissatisfied,Often,Unhappy,Unfair treatment. Safety concerns. Weather challenges. Good working environment.,Citrus Production,Citrusdal,Farm Worker,Seasonal,1
889,2025-01,Sometimes supported,Neutral,Sometimes,Neutral,Safety is prioritized. Supportive supervisors. Safety concerns. Too much overtime.,Pack House Operations,Citrusdal Pack House,Sorter,Permanent,181
892,2025-01,Sometimes supported,Neutral,Sometimes,Happy,Fair pay. Respectful treatment. Inadequate breaks. Long hours.,Pack House Operations,Citrusdal Pack House,Logistics Coordinator,Permanent,158
893,2025-01,Often supported,Satisfied,Rarely,Happy,Regular breaks. Supportive supervisors. Opportunities to learn. Poor communication.,Cattle Farming,Dullstroom,Animal Care Specialist,Permanent,152
894,2025-01,Rarely supported,Dissatisfied,Often,Happy,Unfair treatment. Inadequate breaks. Long hours.,Citrus Production,Citrusdal,Tractor Driver,Contract,1
897,2025-01,Sometimes supported,Neutral,Sometimes,Happy,Good team. Clear instructions. Too much overtime. Unfair treatment.,Maintenance,Citrusdal Pack House,Maintenance Worker,Permanent,63
902,2025-01,Sometimes supported,Neutral,Sometimes,Unhappy,Opportunities to learn. Good working environment. Inadequate breaks. Weather challenges.,Pack House Operations,Citrusdal Pack House,Quality Inspector,Permanent,153
904,2025-01,Often supported,Satisfied,Rarely,Neutral,Proper equipment provided. Regular breaks. Supportive supervisors. Safety concerns.,Logistics,Graaff-Reinet,Logistics Supervisor,Permanent,122
906,2025-01,Often supported,Satisfied,Rarely,Happy,Safety is prioritized. Good team. Good communication.,Maintenance,Dullstroom,Equipment Technician,Permanent,149
907,2025-01,Sometimes supported,Neutral,Sometimes,Neutral,Supportive supervisors. Opportunities to learn. Weather challenges. Housing problems.,Logistics,Ceres Pack House,Dispatcher,Permanent,112
916,2025-01,Sometimes supported,Neutral,Sometimes,Neutral,Good team. Good communication. Transportation issues. Housing problems.,Administration,Dullstroom,Admin Clerk,Permanent,188
918,2025-01,Sometimes supported,Neutral,Sometimes,Unhappy,Good working environment. Proper equipment provided. Weather challenges. Poor communication.,Logistics,Upington,Forklift Operator,Permanent,5
922,2025-01,Often supported,Satisfied,Sometimes,Neutral,Regular breaks. Safety is prioritized. Clear instructions.,Maintenance,Ceres Pack House,Maintenance Worker,Permanent,82
923,2025-01,Sometimes supported,Neutral,Sometimes,Neutral,Clear instructions. Good communication. Housing problems. Inadequate breaks.,Administration,Upington,Data Entry Clerk,Contract,29
924,2025-01,Often supported,Satisfied,Rarely,Happy,Good communication. Respectful treatment. Regular breaks.,Maintenance,Dullstroom,Electrician,Permanent,94
926,2025-01,Sometimes supported,Neutral,Sometimes,Unhappy,Opportunities to learn. Regular breaks. Poor communication. Weather challenges.,Administration,Dullstroom,Office Manager,Permanent,6
929,2025-01,Sometimes supported,Neutral,Often,Neutral,Fair pay. Respectful treatment. Long hours. Low wages.,Pack House Operations,Citrusdal Pack House,Logistics Coordinator,Permanent,104
932,2025-01,Often supported,Satisfied,Rarely,Neutral,Clear instructions. Good communication. Opportunities to learn.,Administration,Dullstroom,HR Assistant,Permanent,125
937,2025-01,Sometimes supported,Neutral,Sometimes,Happy,Good communication. Respectful treatment. Housing problems. Safety concerns.,Maintenance,Citrusdal,Equipment Technician,Contract,45
938,2025-01,Sometimes supported,Neutral,Often,Neutral,Good communication. Clear instructions. Unfair treatment. Heavy workload.,Administration,Ceres Pack House,HR Assistant,Permanent,140
939,2025-01,Sometimes supported,Neutral,Sometimes,Unhappy,Good communication. Good working environment. Too much overtime. Low wages.,Administration,Dullstroom,Office Manager,Permanent,6
940,2025-01,Often supported,Satisfied,Rarely,Happy,Supportive supervisors. Good working environment. Opportunities to learn.,Citrus Production,Ceres,Tractor Driver,Permanent,36
943,2025-01,Often supported,Satisfied,Rarely,Neutral,Respectful treatment. Regular breaks. Good team.,Maintenance,Citrusdal,Mechanic,Permanent,74
944,2025-01,Sometimes supported,Neutral,Often,Neutral,Opportunities to learn. Good working environment. Transportation issues. Low wages.,Administration,Upington,HR Assistant,Permanent,26
945,2025-01,Not at all supported,Very dissatisfied,Often,Very unhappy,Heavy workload. Poor communication. Long hours. Good communication.,Cattle Farming,Dullstroom,Animal Care Specialist,Seasonal,4
946,2025-01,Sometimes supported,Neutral,Sometimes,Neutral,Opportunities to learn. Clear instructions. Too much overtime. Poor equipment.,Cattle Farming,Dullstroom,Farm Hand,Contract,31
947,2025-01,Often supported,Satisfied,Rarely,Happy,Supportive supervisors. Proper equipment provided. Regular breaks. Housing problems.,Administration,Citrusdal,Data Entry Clerk,Permanent,16
950,2025-01,Often supported,Satisfied,Rarely,Happy,Good working environment. Safety is prioritized. Fair management. Long hours.,Maize Production,Graaff-Reinet,Tractor Driver,Permanent,47
951,2025-01,Rarely supported,Dissatisfied,Often,Very unhappy,Housing problems. Long hours. Poor communication.,Pack House Operations,Citrusdal Pack House,Packer,Contract,17
956,2025-01,Sometimes supported,Neutral,Sometimes,Unhappy,Respectful treatment. Regular breaks. Poor equipment. Too much overtime.,Logistics,Graaff-Reinet,Dispatcher,Contract,37
959,2025-01,Often supported,Satisfied,Rarely,Happy,Fair management. Safety is prioritized. Clear instructions.,Logistics,Graaff-Reinet,Dispatcher,Permanent,5
962,2025-01,Sometimes supported,Neutral,Sometimes,Neutral,Fair management. Safety is prioritized. Poor communication. Heavy workload.,Logistics,Graaff-Reinet,Forklift Operator,Contract,16
965,2025-01,Often supported,Satisfied,Rarely,Happy,Fair pay. Good working environment. Respectful treatment. Unfair treatment.,Administration,Dullstroom,Admin Clerk,Permanent,183
966,2025-01,Sometimes supported,Neutral,Sometimes,Happy,Proper equipment provided. Supportive supervisors. Long hours. Heavy workload.,Citrus Production,Citrusdal,Tractor Driver,Permanent,114
969,2025-01,Sometimes supported,Neutral,Rarely,Neutral,Fair pay. Good communication. Low wages. Weather challenges.,Logistics,Citrusdal,Logistics Supervisor,Permanent,12
970,2025-01,Always supported,Very satisfied,Never,Happy,Proper equipment provided. Opportunities to learn. Fair management.,Maize Production,Graaff-Reinet,Harvester,Permanent,129
974,2025-01,Sometimes supported,Neutral,Sometimes,Neutral,Fair pay. Respectful treatment. Weather challenges. Too much overtime.,Pack House Operations,Ceres,Machine Operator,Seasonal,4
976,2025-01,Often supported,Satisfied,Rarely,Happy,Respectful treatment. Proper equipment provided. Fair management.,Pack House Operations,Ceres,Logistics Coordinator,Permanent,121
977,2025-01,Sometimes supported,Neutral,Sometimes,Unhappy,Respectful treatment. Fair management. Inadequate breaks. Poor equipment.,Pack House Operations,Ceres,Machine Operator,Permanent,58
978,2025-01,Often supported,Satisfied,Rarely,Happy,Proper equipment provided. Supportive supervisors. Safety is prioritized. Heavy workload.,Logistics,Upington,Dispatcher,Permanent,161
981,2025-01,Rarely supported,Dissatisfied,Sometimes,Neutral,Heavy workload. Transportation issues. Inadequate breaks.,Maize Production,Graaff-Reinet,Farm Worker,Seasonal,4
983,2025-01,Sometimes supported,Neutral,Sometimes,Neutral,Regular breaks. Opportunities to learn. Low wages. Inadequate breaks.,Pack House Operations,Ceres,Logistics Coordinator,Permanent,55
985,2025-01,Often supported,Satisfied,Sometimes,Happy,Fair pay. Safety is prioritized. Regular breaks.,Administration,Ceres Pack House,Office Manager,Permanent,158
986,2025-01,Rarely supported,Dissatisfied,Often,Very unhappy,Unfair treatment. Housing problems. Long hours. Fair management.,Citrus Production,Citrusdal,Harvester,Seasonal,3
987,2025-01,Often supported,Satisfied,Never,Happy,Fair pay. Respectful treatment. Good team.,Maintenance,Upington,Maintenance Worker,Permanent,120
989,2025-01,Rarely supported,Dissatisfied,Often,Unhappy,Housing problems. Poor communication. Long hours.,Maintenance,Dullstroom,Maintenance Worker,Seasonal,4
995,2025-01,Often supported,Satisfied,Rarely,Unhappy,Clear instructions. Regular breaks. Respectful treatment.,Maintenance,Dullstroom,Electrician,Permanent,25
997,2025-01,Often supported,Satisfied,Sometimes,Unhappy,Proper equipment provided. Fair management. Good team. Weather challenges.,Citrus Production,Ceres,Harvester,Permanent,141
3,2024-12,Often supported,Satisfied,Sometimes,Happy,Respectful treatment. Good team. Opportunities to learn. Safety concerns.,Management,Upington,Production Manager,Permanent,128
4,2024-12,Sometimes supported,Neutral,Sometimes,Neutral,Safety is prioritized. Clear instructions. Transportation issues. Too much overtime.,Management,Ceres Pack House,Operations Manager,Permanent,66
5,2024-12,Sometimes supported,Neutral,Sometimes,Neutral,Fair pay. Regular breaks. Too much overtime. Housing problems.,Management,Ceres Pack House,Finance Manager,Permanent,175
6,2024-12,Sometimes supported,Neutral,Sometimes,Unhappy,Respectful treatment. Proper equipment provided. Heavy workload. Long hours.,Management,Dullstroom,HR Manager,Permanent,188
7,2024-12,Often supported,Satisfied,Sometimes,Neutral,Fair pay. Respectful treatment. Good working environment. Safety concerns.,Management,Ceres Pack House,Production Manager,Permanent,70
8,2024-12,Sometimes supported,Neutral,Sometimes,Neutral,Fair management. Safety is prioritized. Weather challenges. Poor equipment.,Management,Citrusdal,Production Manager,Permanent,118
9,2024-12,Often supported,Satisfied,Sometimes,Neutral,Good working environment. Good team. Proper equipment provided.,Management,Ceres,HR Manager,Permanent,99
10,2024-12,Often supported,Satisfied,Rarely,Neutral,Good team. Proper equipment provided. Respectful treatment. Too much overtime.,Management,Dullstroom,HR Manager,Permanent,168
11,2024-12,Often supported,Satisfied,Rarely,Happy,Opportunities to learn. Supportive supervisors. Respectful treatment. Weather challenges.,Management,Citrusdal Pack House,Production Manager,Permanent,23
12,2024-12,Sometimes supported,Neutral,Sometimes,Neutral,Fair management. Good communication. Transportation issues. Long hours.,Management,Dullstroom,General Manager,Permanent,189
14,2024-12,Sometimes supported,Neutral,Sometimes,Neutral,Safety is prioritized. Opportunities to learn. Safety concerns. Unfair treatment.,Management,Ceres Pack House,General Manager,Permanent,102
15,2024-12,Sometimes supported,Neutral,Sometimes,Happy,Fair pay. Regular breaks. Inadequate breaks. Too much overtime.,Management,Citrusdal,Operations Manager,Permanent,141
16,2024-12,Often supported,Satisfied,Rarely,Happy,Proper equipment provided. Good communication. Good working environment.,Management,Upington,HR Manager,Permanent,135
18,2024-12,Sometimes supported,Neutral,Rarely,Very happy,Proper equipment provided. Supportive supervisors. Poor equipment. Heavy workload.,Management,Graaff-Reinet,Production Manager,Permanent,148
20,2024-12,Often supported,Satisfied,Never,Happy,Fair pay. Good working environment. Good team.,Management,Upington,Operations Manager,Permanent,177
21,2024-12,Sometimes supported,Neutral,Rarely,Neutral,Fair pay. Fair management. Housing problems. Unfair treatment.,Management,Citrusdal,Production Manager,Permanent,166
22,2024-12,Often supported,Satisfied,Rarely,Neutral,Fair pay. Clear instructions. Fair management. Poor equipment.,Management,Graaff-Reinet,Finance Manager,Permanent,57
23,2024-12,Often supported,Satisfied,Sometimes,Neutral,Opportunities to learn. Clear instructions. Safety is prioritized.,Management,Citrusdal Pack House,General Manager,Permanent,165
24,2024-12,Often supported,Satisfied,Sometimes,Happy,Good team. Regular breaks. Proper equipment provided.,Management,Dullstroom,HR Manager,Permanent,155
25,2024-12,Sometimes supported,Neutral,Rarely,Neutral,Respectful treatment. Regular breaks. Weather challenges. Long hours.,Management,Upington,Finance Manager,Permanent,134
27,2024-12,Often supported,Satisfied,Rarely,Very happy,Good communication. Supportive supervisors. Respectful treatment. Unfair treatment.,Management,Graaff-Reinet,General Manager,Permanent,153
29,2024-12,Often supported,Satisfied,Rarely,Happy,Fair pay. Good working environment. Safety is prioritized.,Management,Ceres Pack House,Production Manager,Permanent,82
30,2024-12,Often supported,Satisfied,Rarely,Neutral,Good team. Good communication. Opportunities to learn.,Management,Ceres Pack House,Farm Manager,Permanent,152
31,2024-12,Often supported,Satisfied,Rarely,Very happy,Respectful treatment. Proper equipment provided. Opportunities to learn.,Management,Citrusdal,Farm Manager,Permanent,90
32,2024-12,Often supported,Satisfied,Rarely,Happy,Fair management. Good communication. Regular breaks. Poor equipment.,Management,Ceres Pack House,Finance Manager,Permanent,136
33,2024-12,Sometimes supported,Neutral,Rarely,Unhappy,Good communication. Good working environment. Transportation issues. Poor communication.,Management,Graaff-Reinet,General Manager,Permanent,27
34,2024-12,Rarely supported,Dissatisfied,Sometimes,Unhappy,Housing problems. Low wages. Inadequate breaks.,Management,Ceres Pack House,Farm Manager,Permanent,86
36,2024-12,Sometimes supported,Neutral,Rarely,Neutral,Opportunities to learn. Good working environment. Inadequate breaks. Poor communication.,Management,Dullstroom,Operations Manager,Permanent,43
37,2024-12,Sometimes supported,Neutral,Sometimes,Neutral,Good team. Respectful treatment. Weather challenges. Unfair treatment.,Management,Ceres,Production Manager,Permanent,124
39,2024-12,Often supported,Satisfied,Rarely,Unhappy,Supportive supervisors. Good working environment. Fair management.,Management,Ceres Pack House,Finance Manager,Permanent,148
40,2024-12,Sometimes supported,Neutral,Rarely,Neutral,Regular breaks. Fair pay. Weather challenges. Inadequate breaks.,Management,Ceres,Farm Manager,Permanent,27
42,2024-12,Sometimes supported,Neutral,Sometimes,Neutral,Good working environment. Clear instructions. Poor communication. Safety concerns.,Management,Graaff-Reinet,HR Manager,Permanent,176
43,2024-12,Rarely supported,Dissatisfied,Sometimes,Unhappy,Heavy workload. Too much overtime. Low wages.,Management,Citrusdal Pack House,Operations Manager,Permanent,88
44,2024-12,Sometimes supported,Neutral,Sometimes,Happy,Fair management. Proper equipment provided. Housing problems. Poor communication.,Management,Dullstroom,General Manager,Permanent,139
45,2024-12,Sometimes supported,Neutral,Sometimes,Happy,Regular breaks. Clear instructions. Too much overtime. Poor equipment.,Management,Ceres,HR Manager,Permanent,44
46,2024-12,Sometimes supported,Neutral,Often,Happy,Good communication. Regular breaks. Long hours. Too much overtime.,Management,Upington,Finance Manager,Permanent,86
48,2024-12,Often supported,Satisfied,Sometimes,Neutral,Fair management. Good team. Good working environment.,Management,Ceres,HR Manager,Permanent,84
49,2024-12,Sometimes supported,Neutral,Rarely,Neutral,Good working environment. Clear instructions. Weather challenges. Inadequate breaks.,Management,Upington,General Manager,Permanent,138
50,2024-12,Often supported,Satisfied,Never,Happy,Safety is prioritized. Supportive supervisors. Good team.,Management,Citrusdal,Operations Manager,Permanent,143
54,2024-12,Often supported,Satisfied,Rarely,Neutral,Fair pay. Respectful treatment. Fair management.,Logistics,Upington,Logistics Supervisor,Permanent,15
56,2024-12,Often supported,Satisfied,Rarely,Happy,Safety is prioritized. Regular breaks. Fair management.,Cattle Farming,Dullstroom,Cattle Herder,Permanent,142
59,2024-12,Sometimes supported,Neutral,Sometimes,Unhappy,Proper equipment provided. Good team. Heavy workload. Too much overtime.,Pack House Operations,Citrusdal Pack House,Machine Operator,Permanent,94
61,2024-12,Sometimes supported,Neutral,Rarely,Unhappy,Supportive supervisors. Regular breaks. Inadequate breaks. Heavy workload.,Pack House Operations,Ceres Pack House,Logistics Coordinator,Permanent,154
62,2024-12,Often supported,Satisfied,Sometimes,Neutral,Safety is prioritized. Regular breaks. Good communication.,Logistics,Graaff-Reinet,Logistics Supervisor,Permanent,154
63,2024-12,Not at all supported,Very dissatisfied,Always,Neutral,Long hours. Poor communication. Heavy workload.,Pack House Operations,Ceres Pack House,Machine Operator,Seasonal,3
65,2024-12,Often supported,Satisfied,Rarely,Neutral,Fair management. Opportunities to learn. Respectful treatment.,Pack House Operations,Citrusdal Pack House,Machine Operator,Permanent,120
66,2024-12,Often supported,Satisfied,Rarely,Happy,Safety is prioritized. Good working environment. Good team.,Logistics,Ceres Pack House,Driver,Permanent,147
68,2024-12,Sometimes supported,Neutral,Often,Unhappy,Clear instructions. Good working environment. Poor equipment. Too much overtime.,Grape Production,Upington,Vineyard Worker,Permanent,83
76,2024-12,Rarely supported,Dissatisfied,Sometimes,Happy,Long hours. Inadequate breaks. Transportation issues.,Maintenance,Upington,Maintenance Supervisor,Contract,12
77,2024-12,Sometimes supported,Neutral,Sometimes,Unhappy,Good communication. Safety is prioritized. Unfair treatment. Transportation issues.,Logistics,Citrusdal Pack House,Logistics Supervisor,Permanent,109
78,2024-12,Sometimes supported,Neutral,Often,Neutral,Respectful treatment. Good working environment. Long hours. Low wages.,Citrus Production,Ceres,Tractor Driver,Permanent,66
79,2024-12,Often supported,Satisfied,Rarely,Happy,Opportunities to learn. Respectful treatment. Fair management.,Citrus Production,Citrusdal,Irrigation Specialist,Permanent,49
80,2024-12,Rarely supported,Dissatisfied,Sometimes,Unhappy,Poor communication. Weather challenges. Long hours.,Administration,Dullstroom,Data Entry Clerk,Seasonal,3
88,2024-12,Often supported,Satisfied,Rarely,Very happy,Respectful treatment. Good team. Safety is prioritized.,Logistics,Ceres,Forklift Operator,Permanent,123
90,2024-12,Sometimes supported,Neutral,Often,Happy,Fair pay. Respectful treatment. Weather challenges. Unfair treatment.,Citrus Production,Ceres,Farm Supervisor,Permanent,172
91,2024-12,Often supported,Satisfied,Rarely,Happy,Good team. Good communication. Fair pay.,Logistics,Ceres Pack House,Warehouse Worker,Permanent,32
93,2024-12,Sometimes supported,Neutral,Sometimes,Very unhappy,Good team. Proper equipment provided. Unfair treatment. Long hours.,Grape Production,Upington,Vineyard Supervisor,Permanent,170
95,2024-12,Often supported,Satisfied,Rarely,Neutral,Clear instructions. Safety is prioritized. Regular breaks.,Citrus Production,Ceres,Harvester,Permanent,62
97,2024-12,Sometimes supported,Neutral,Often,Neutral,Proper equipment provided. Safety is prioritized. Transportation issues. Low wages.,Logistics,Ceres Pack House,Driver,Permanent,95
99,2024-12,Often supported,Satisfied,Rarely,Happy,Good working environment. Fair pay. Fair management.,Maintenance,Upington,Mechanic,Permanent,58
100,2024-12,Sometimes supported,Neutral,Sometimes,Unhappy,Regular breaks. Good communication. Inadequate breaks. Low wages.,Maintenance,Dullstroom,Maintenance Worker,Seasonal,3
101,2024-12,Sometimes supported,Neutral,Rarely,Happy,Proper equipment provided. Clear instructions. Poor equipment. Inadequate breaks.,Maize Production,Graaff-Reinet,Farm Worker,Permanent,56
106,2024-12,Sometimes supported,Neutral,Sometimes,Neutral,Opportunities to learn. Regular breaks. Weather challenges. Low wages.,Logistics,Upington,Warehouse Worker,Permanent,160
107,2024-12,Sometimes supported,Neutral,Sometimes,Very unhappy,Fair pay. Opportunities to learn. Housing problems. Safety concerns.,Maintenance,Citrusdal,Maintenance Worker,Contract,18
108,2024-12,Often supported,Satisfied,Never,Very happy,Fair management. Fair pay. Good team.,Logistics,Ceres,Driver,Permanent,185
110,2024-12,Sometimes supported,Neutral,Sometimes,Neutral,Proper equipment provided. Good working environment. Transportation issues. Unfair treatment.,Citrus Production,Citrusdal,Harvester,Contract,23
111,2024-12,Sometimes supported,Neutral,Rarely,Neutral,Good communication. Fair pay. Transportation issues. Safety concerns.,Logistics,Citrusdal Pack House,Forklift Operator,Permanent,11
112,2024-12,Sometimes supported,Neutral,Sometimes,Neutral,Good working environment. Good team. Inadequate breaks. Heavy workload.,Administration,Graaff-Reinet,HR Assistant,Permanent,121
114,2024-12,Often supported,Satisfied,Rarely,Happy,Fair pay. Good team. Proper equipment provided.,Maintenance,Dullstroom,Equipment Technician,Permanent,38
116,2024-12,Often supported,Satisfied,Never,Neutral,Proper equipment provided. Fair management. Respectful treatment. Safety concerns.,Maintenance,Upington,Electrician,Permanent,16
117,2024-12,Often supported,Satisfied,Sometimes,Neutral,Supportive supervisors. Good communication. Good working environment.,Pack House Operations,Ceres Pack House,Logistics Coordinator,Permanent,69
119,2024-12,Sometimes supported,Neutral,Sometimes,Neutral,Clear instructions. Supportive supervisors. Safety concerns. Too much overtime.,Maintenance,Citrusdal Pack House,Mechanic,Contract,45
124,2024-12,Rarely supported,Dissatisfied,Often,Very unhappy,Inadequate breaks. Safety concerns. Poor communication. Good communication.,Maize Production,Graaff-Reinet,Farm Worker,Seasonal,3
127,2024-12,Often supported,Satisfied,Sometimes,Happy,Respectful treatment. Fair management. Good team.,Maintenance,Ceres Pack House,Equipment Technician,Permanent,103
129,2024-12,Sometimes supported,Neutral,Sometimes,Happy,Safety is prioritized. Clear instructions. Poor communication. Long hours.,Administration,Citrusdal Pack House,Payroll Officer,Permanent,29
130,2024-12,Not at all supported,Very dissatisfied,Always,Very unhappy,Safety concerns. Heavy workload. Weather challenges.,Maize Production,Graaff-Reinet,Harvester,Seasonal,2
132,2024-12,Often supported,Satisfied,Rarely,Happy,Opportunities to learn. Good communication. Fair pay.,Maintenance,Dullstroom,Maintenance Supervisor,Permanent,146
134,2024-12,Rarely supported,Dissatisfied,Often,Neutral,Unfair treatment. Low wages. Too much overtime.,Maize Production,Graaff-Reinet,Harvester,Seasonal,2
135,2024-12,Rarely supported,Dissatisfied,Sometimes,Happy,Transportation issues. Poor equipment. Safety concerns.,Logistics,Ceres Pack House,Forklift Operator,Permanent,115
139,2024-12,Rarely supported,Dissatisfied,Often,Unhappy,Low wages. Long hours. Weather challenges.,Citrus Production,Ceres,Farm Worker,Seasonal,2
142,2024-12,Sometimes supported,Neutral,Rarely,Happy,Clear instructions. Supportive supervisors. Transportation issues. Weather challenges.,Citrus Production,Ceres,Farm Supervisor,Permanent,152
145,2024-12,Rarely supported,Dissatisfied,Often,Neutral,Transportation issues. Safety concerns. Unfair treatment.,Logistics,Ceres Pack House,Dispatcher,Permanent,84
147,2024-12,Often supported,Satisfied,Rarely,Happy,Opportunities to learn. Good communication. Safety is prioritized.,Logistics,Graaff-Reinet,Forklift Operator,Permanent,49
148,2024-12,Sometimes supported,Neutral,Sometimes,Neutral,Good team. Good communication. Too much overtime. Heavy workload.,Administration,Dullstroom,Data Entry Clerk,Contract,2
