employee_id,survey_month,support_feeling,job_satisfaction,exhaustion_feeling,work_mood,feedback_text,department,location,job_title,worker_type,tenure_months
119,2024-11,Sometimes supported,Neutral,Often,Neutral,Good working environment. Clear instructions. Too much overtime. Inadequate breaks.,Maintenance,Citrusdal Pack House,Mechanic,Contract,44
123,2024-11,Often supported,Satisfied,Never,Happy,Good communication. Regular breaks. Clear instructions.,Maintenance,Upington,Maintenance Supervisor,Permanent,124
124,2024-11,Rarely supported,Dissatisfied,Always,Unhappy,Weather challenges. Safety concerns. Inadequate breaks.,Maize Production,Graaff-Reinet,Farm Worker,Seasonal,2
129,2024-11,Often supported,Satisfied,Rarely,Very happy,Proper equipment provided. Supportive supervisors. Regular breaks.,Administration,Citrusdal Pack House,Payroll Officer,Permanent,28
135,2024-11,Often supported,Satisfied,Sometimes,Neutral,Proper equipment provided. Good working environment. Good communication.,Logistics,Ceres Pack House,Forklift Operator,Permanent,114
138,2024-11,Sometimes supported,Neutral,Often,Neutral,Fair pay. Supportive supervisors. Poor communication. Transportation issues.,Administration,Ceres Pack House,Admin Clerk,Contract,33
140,2024-11,Rarely supported,Dissatisfied,Often,Neutral,Low wages. Inadequate breaks. Safety concerns.,Logistics,Citrusdal Pack House,Driver,Permanent,67
142,2024-11,Sometimes supported,Neutral,Sometimes,Unhappy,Good team. Respectful treatment. Unfair treatment. Housing problems.,Citrus Production,Ceres,Farm Supervisor,Permanent,151
148,2024-11,Not at all supported,Very dissatisfied,Always,Very unhappy,Low wages. Unfair treatment. Housing problems.,Administration,Dullstroom,Data Entry Clerk,Contract,1
158,2024-11,Often supported,Satisfied,Rarely,Neutral,Regular breaks. Good communication. Good team.,Administration,Citrusdal,Admin Clerk,Permanent,90
161,2024-11,Often supported,Satisfied,Rarely,Happy,Fair pay. Regular breaks. Good team.,Grape Production,Upington,Pruner,Permanent,69
163,2024-11,Often supported,Satisfied,Sometimes,Unhappy,Supportive supervisors. Opportunities to learn. Clear instructions. Unfair treatment.,Administration,Ceres Pack House,Data Entry Clerk,Permanent,131
164,2024-11,Sometimes supported,Neutral,Sometimes,Neutral,Opportunities to learn. Good team. Unfair treatment. Inadequate breaks.,Citrus Production,Ceres,Farm Worker,Permanent,59
166,2024-11,Often supported,Satisfied,Sometimes,Happy,Fair pay. Good team. Regular breaks.,Cattle Farming,Dullstroom,Farm Hand,Permanent,114
168,2024-11,Sometimes supported,Neutral,Often,Neutral,Regular breaks. Safety is prioritized. Transportation issues. Too much overtime.,Cattle Farming,Dullstroom,Cattle Herder,Contract,6
169,2024-11,Often supported,Satisfied,Rarely,Very happy,Proper equipment provided. Fair management. Supportive supervisors.,Administration,Dullstroom,Data Entry Clerk,Contract,37
172,2024-11,Sometimes supported,Neutral,Sometimes,Neutral,Respectful treatment. Safety is prioritized. Weather challenges. Poor equipment.,Cattle Farming,Dullstroom,Livestock Supervisor,Permanent,148
176,2024-11,Often supported,Satisfied,Rarely,Happy,Good team. Fair pay. Respectful treatment.,Maintenance,Citrusdal,Electrician,Permanent,64
177,2024-11,Rarely supported,Dissatisfied,Often,Unhappy,Safety concerns. Housing problems. Inadequate breaks. Good working environment.,Pack House Operations,Citrusdal Pack House,Sorter,Contract,19
182,2024-11,Often supported,Satisfied,Sometimes,Neutral,Regular breaks. Good working environment. Fair pay.,Administration,Citrusdal,Admin Clerk,Permanent,178
183,2024-11,Sometimes supported,Neutral,Sometimes,Happy,Regular breaks. Good working environment. Transportation issues. Safety concerns.,Logistics,Graaff-Reinet,Logistics Supervisor,Permanent,132
184,2024-11,Sometimes supported,Neutral,Sometimes,Happy,Good communication. Opportunities to learn. Transportation issues. Safety concerns.,Logistics,Ceres,Dispatcher,Permanent,20
186,2024-11,Often supported,Satisfied,Sometimes,Neutral,Supportive supervisors. Regular breaks. Proper equipment provided.,Logistics,Citrusdal,Logistics Supervisor,Permanent,112
191,2024-11,Rarely supported,Dissatisfied,Often,Very unhappy,Unfair treatment. Poor equipment. Heavy workload.,Citrus Production,Ceres,Farm Worker,Seasonal,1
193,2024-11,Sometimes supported,Neutral,Sometimes,Unhappy,Opportunities to learn. Fair management. Low wages. Inadequate breaks.,Logistics,Upington,Warehouse Worker,Permanent,98
200,2024-11,Sometimes supported,Neutral,Sometimes,Neutral,Good team. Good communication. Heavy workload. Low wages.,Citrus Production,Ceres,Tractor Driver,Permanent,2
203,2024-11,Often supported,Satisfied,Sometimes,Happy,Supportive supervisors. Good communication. Safety is prioritized. Low wages.,Administration,Ceres,Office Manager,Permanent,32
205,2024-11,Rarely supported,Dissatisfied,Often,Neutral,Transportation issues. Heavy workload. Low wages.,Pack House Operations,Citrusdal Pack House,Floor Supervisor,Seasonal,1
208,2024-11,Sometimes supported,Neutral,Sometimes,Neutral,Opportunities to learn. Clear instructions. Heavy workload. Unfair treatment.,Logistics,Citrusdal,Forklift Operator,Permanent,87
211,2024-11,Often supported,Satisfied,Never,Very happy,Regular breaks. Good working environment. Opportunities to learn.,Administration,Graaff-Reinet,HR Assistant,Permanent,105
213,2024-11,Often supported,Satisfied,Rarely,Happy,Good working environment. Regular breaks. Good communication.,Administration,Citrusdal,Payroll Officer,Permanent,132
216,2024-11,Rarely supported,Dissatisfied,Often,Unhappy,Low wages. Safety concerns. Too much overtime.,Pack House Operations,Ceres Pack House,Packer,Seasonal,2
222,2024-11,Sometimes supported,Neutral,Often,Neutral,Good team. Supportive supervisors. Poor communication. Unfair treatment.,Logistics,Upington,Warehouse Worker,Permanent,138
224,2024-11,Sometimes supported,Neutral,Rarely,Neutral,Good team. Supportive supervisors. Poor communication. Housing problems.,Administration,Ceres,Office Manager,Contract,7
227,2024-11,Sometimes supported,Neutral,Sometimes,Happy,Regular breaks. Respectful treatment. Housing problems. Low wages.,Maintenance,Graaff-Reinet,Equipment Technician,Permanent,82
228,2024-11,Sometimes supported,Neutral,Sometimes,Neutral,Good working environment. Fair management. Poor equipment. Too much overtime.,Pack House Operations,Ceres,Floor Supervisor,Permanent,58
232,2024-11,Sometimes supported,Neutral,Sometimes,Neutral,Opportunities to learn. Supportive supervisors. Inadequate breaks. Low wages.,Administration,Ceres,Admin Clerk,Permanent,54
235,2024-11,Sometimes supported,Neutral,Sometimes,Happy,Supportive supervisors. Regular breaks. Long hours. Transportation issues.,Administration,Ceres Pack House,Payroll Officer,Permanent,135
236,2024-11,Sometimes supported,Neutral,Rarely,Happy,Good team. Respectful treatment. Poor equipment. Housing problems.,Administration,Ceres Pack House,Admin Clerk,Permanent,2
237,2024-11,Often supported,Satisfied,Rarely,Happy,Fair pay. Respectful treatment. Regular breaks. Poor equipment.,Citrus Production,Citrusdal,Farm Worker,Permanent,171
238,2024-11,Often supported,Satisfied,Rarely,Happy,Supportive supervisors. Good team. Respectful treatment.,Maintenance,Ceres Pack House,Electrician,Permanent,148
249,2024-11,Often supported,Satisfied,Sometimes,Happy,Proper equipment provided. Good working environment. Clear instructions.,Maintenance,Upington,Mechanic,Permanent,165
253,2024-11,Often supported,Satisfied,Sometimes,Happy,Supportive supervisors. Good communication. Good team.,Citrus Production,Citrusdal,Tractor Driver,Permanent,138
255,2024-11,Often supported,Satisfied,Never,Happy,Good communication. Supportive supervisors. Good team. Poor equipment.,Administration,Dullstroom,Office Manager,Permanent,142
256,2024-11,Sometimes supported,Neutral,Rarely,Neutral,Regular breaks. Good communication. Poor equipment. Inadequate breaks.,Pack House Operations,Ceres Pack House,Quality Inspector,Permanent,94
261,2024-11,Sometimes supported,Neutral,Sometimes,Neutral,Opportunities to learn. Proper equipment provided. Safety concerns. Poor equipment.,Logistics,Ceres,Forklift Operator,Permanent,1
262,2024-11,Sometimes supported,Neutral,Rarely,Neutral,Fair management. Supportive supervisors. Safety concerns. Unfair treatment.,Maintenance,Dullstroom,Maintenance Worker,Permanent,63
263,2024-11,Often supported,Satisfied,Sometimes,Happy,Respectful treatment. Regular breaks. Supportive supervisors.,Pack House Operations,Citrusdal Pack House,Packer,Permanent,142
265,2024-11,Rarely supported,Dissatisfied,Rarely,Very unhappy,Heavy workload. Poor equipment. Unfair treatment. Clear instructions.,Logistics,Ceres Pack House,Forklift Operator,Permanent,55
266,2024-11,Often supported,Satisfied,Rarely,Neutral,Opportunities to learn. Regular breaks. Supportive supervisors.,Maintenance,Citrusdal Pack House,Mechanic,Permanent,166
268,2024-11,Often supported,Satisfied,Sometimes,Neutral,Good communication. Fair pay. Opportunities to learn.,Logistics,Citrusdal,Warehouse Worker,Permanent,85
271,2024-11,Sometimes supported,Neutral,Sometimes,Very unhappy,Good team. Safety is prioritized. Unfair treatment. Transportation issues.,Administration,Citrusdal Pack House,Admin Clerk,Permanent,10
272,2024-11,Sometimes supported,Neutral,Sometimes,Very happy,Fair pay. Safety is prioritized. Transportation issues. Long hours.,Grape Production,Upington,Vineyard Supervisor,Permanent,65
273,2024-11,Sometimes supported,Neutral,Rarely,Happy,Good working environment. Fair management. Housing problems. Inadequate breaks.,Logistics,Upington,Warehouse Worker,Permanent,58
275,2024-11,Often supported,Satisfied,Rarely,Happy,Safety is prioritized. Regular breaks. Fair pay.,Maintenance,Dullstroom,Maintenance Worker,Permanent,135
278,2024-11,Often supported,Satisfied,Sometimes,Happy,Opportunities to learn. Proper equipment provided. Fair pay.,Maintenance,Citrusdal,Equipment Technician,Permanent,6
279,2024-11,Often supported,Satisfied,Sometimes,Happy,Fair management. Good team. Proper equipment provided.,Grape Production,Upington,Harvester,Permanent,70
280,2024-11,Not at all supported,Very dissatisfied,Always,Very unhappy,Unfair treatment. Too much overtime. Inadequate breaks.,Citrus Production,Ceres,Harvester,Seasonal,1
281,2024-11,Often supported,Satisfied,Never,Happy,Opportunities to learn. Fair management. Good working environment.,Logistics,Citrusdal,Dispatcher,Permanent,101
283,2024-11,Sometimes supported,Neutral,Rarely,Unhappy,Safety is prioritized. Opportunities to learn. Poor communication. Inadequate breaks.,Administration,Citrusdal Pack House,Admin Clerk,Permanent,49
285,2024-11,Sometimes supported,Neutral,Sometimes,Neutral,Opportunities to learn. Clear instructions. Heavy workload. Safety concerns.,Cattle Farming,Dullstroom,Livestock Supervisor,Permanent,63
286,2024-11,Often supported,Satisfied,Sometimes,Happy,Fair pay. Safety is prioritized. Opportunities to learn.,Grape Production,Upington,Vineyard Worker,Permanent,20
291,2024-11,Often supported,Satisfied,Rarely,Happy,Fair management. Fair pay. Good communication.,Administration,Ceres Pack House,Admin Clerk,Permanent,18
292,2024-11,Sometimes supported,Neutral,Sometimes,Very unhappy,Good team. Respectful treatment. Heavy workload. Housing problems.,Logistics,Ceres Pack House,Warehouse Worker,Contract,4
293,2024-11,Rarely supported,Dissatisfied,Sometimes,Unhappy,Too much overtime. Poor equipment. Unfair treatment.,Citrus Production,Citrusdal,Harvester,Contract,37
294,2024-11,Often supported,Satisfied,Sometimes,Happy,Proper equipment provided. Good communication. Regular breaks.,Administration,Graaff-Reinet,Office Manager,Permanent,45
295,2024-11,Sometimes supported,Neutral,Rarely,Happy,Regular breaks. Fair pay. Safety concerns. Unfair treatment.,Administration,Graaff-Reinet,Data Entry Clerk,Permanent,102
296,2024-11,Sometimes supported,Neutral,Often,Neutral,Supportive supervisors. Regular breaks. Unfair treatment. Long hours.,Maintenance,Dullstroom,Mechanic,Permanent,179
298,2024-11,Sometimes supported,Neutral,Often,Neutral,Safety is prioritized. Fair management. Unfair treatment. Heavy workload.,Citrus Production,Citrusdal,Tractor Driver,Permanent,98
299,2024-11,Often supported,Satisfied,Sometimes,Neutral,Safety is prioritized. Fair pay. Clear instructions. Weather challenges.,Pack House Operations,Ceres,Floor Supervisor,Permanent,48
302,2024-11,Sometimes supported,Neutral,Sometimes,Happy,Safety is prioritized. Fair management. Too much overtime. Long hours.,Logistics,Citrusdal,Driver,Permanent,9
303,2024-11,Often supported,Satisfied,Rarely,Happy,Supportive supervisors. Good working environment. Safety is prioritized.,Administration,Dullstroom,Office Manager,Permanent,182
309,2024-11,Often supported,Satisfied,Never,Neutral,Safety is prioritized. Good team. Fair pay. Weather challenges.,Administration,Citrusdal,Admin Clerk,Permanent,84
311,2024-11,Sometimes supported,Neutral,Sometimes,Unhappy,Good working environment. Respectful treatment. Weather challenges. Transportation issues.,Citrus Production,Citrusdal,Tractor Driver,Seasonal,2
314,2024-11,Sometimes supported,Neutral,Sometimes,Unhappy,Regular breaks. Safety is prioritized. Transportation issues. Long hours.,Maintenance,Dullstroom,Electrician,Contract,29
315,2024-11,Sometimes supported,Neutral,Rarely,Happy,Proper equipment provided. Fair management. Poor communication. Safety concerns.,Maintenance,Upington,Electrician,Permanent,103
316,2024-11,Sometimes supported,Neutral,Sometimes,Happy,Good working environment. Proper equipment provided. Too much overtime. Poor communication.,Administration,Citrusdal Pack House,Payroll Officer,Permanent,2
317,2024-11,Sometimes supported,Neutral,Sometimes,Very happy,Good communication. Good team. Transportation issues. Inadequate breaks.,Logistics,Upington,Driver,Permanent,104
319,2024-11,Often supported,Satisfied,Sometimes,Happy,Good communication. Fair pay. Regular breaks.,Logistics,Citrusdal,Forklift Operator,Permanent,3
321,2024-11,Sometimes supported,Neutral,Rarely,Neutral,Clear instructions. Fair management. Long hours. Poor equipment.,Cattle Farming,Dullstroom,Cattle Herder,Permanent,157
322,2024-11,Sometimes supported,Neutral,Sometimes,Happy,Fair management. Safety is prioritized. Transportation issues. Poor communication.,Maize Production,Graaff-Reinet,Field Supervisor,Permanent,36
323,2024-11,Sometimes supported,Neutral,Rarely,Neutral,Fair pay. Opportunities to learn. Low wages. Long hours.,Administration,Graaff-Reinet,Admin Clerk,Contract,2
328,2024-11,Sometimes supported,Neutral,Rarely,Neutral,Regular breaks. Fair pay. Weather challenges. Inadequate breaks.,Logistics,Ceres Pack House,Forklift Operator,Permanent,183
330,2024-11,Sometimes supported,Neutral,Sometimes,Happy,Fair management. Fair pay. Inadequate breaks. Unfair treatment.,Logistics,Citrusdal,Warehouse Worker,Permanent,137
332,2024-11,Sometimes supported,Neutral,Rarely,Neutral,Good communication. Regular breaks. Housing problems. Transportation issues.,Maintenance,Upington,Electrician,Permanent,41
333,2024-11,Often supported,Satisfied,Sometimes,Neutral,Respectful treatment. Good communication. Supportive supervisors.,Grape Production,Upington,Vineyard Supervisor,Permanent,79
334,2024-11,Often supported,Satisfied,Rarely,Neutral,Good working environment. Good team. Opportunities to learn.,Administration,Ceres,Payroll Officer,Permanent,105
336,2024-11,Sometimes supported,Neutral,Sometimes,Neutral,Clear instructions. Supportive supervisors. Low wages. Poor equipment.,Logistics,Citrusdal,Forklift Operator,Permanent,147
337,2024-11,Sometimes supported,Neutral,Sometimes,Unhappy,Good team. Safety is prioritized. Too much overtime. Poor equipment.,Maintenance,Dullstroom,Maintenance Worker,Seasonal,1
340,2024-11,Sometimes supported,Neutral,Sometimes,Neutral,Fair management. Safety is prioritized. Long hours. Housing problems.,Cattle Farming,Dullstroom,Livestock Supervisor,Permanent,57
346,2024-11,Rarely supported,Dissatisfied,Sometimes,Neutral,Poor equipment. Poor communication. Low wages.,Pack House Operations,Ceres Pack House,Floor Supervisor,Permanent,18
348,2024-11,Rarely supported,Dissatisfied,Often,Very unhappy,Inadequate breaks. Heavy workload. Unfair treatment.,Cattle Farming,Dullstroom,Livestock Supervisor,Seasonal,1
350,2024-11,Rarely supported,Dissatisfied,Often,Happy,Safety concerns. Unfair treatment. Poor communication. Respectful treatment.,Citrus Production,Citrusdal,Farm Supervisor,Seasonal,2
354,2024-11,Sometimes supported,Neutral,Often,Neutral,Opportunities to learn. Good team. Safety concerns. Inadequate breaks.,Administration,Dullstroom,Admin Clerk,Permanent,104
356,2024-11,Often supported,Satisfied,Rarely,Happy,Good working environment. Good team. Regular breaks.,Maintenance,Ceres,Maintenance Worker,Permanent,85
360,2024-11,Often supported,Satisfied,Sometimes,Happy,Opportunities to learn. Safety is prioritized. Good working environment.,Logistics,Graaff-Reinet,Logistics Supervisor,Permanent,38
362,2024-11,Often supported,Satisfied,Rarely,Happy,Clear instructions. Good working environment. Safety is prioritized.,Maintenance,Upington,Electrician,Permanent,13
363,2024-11,Often supported,Satisfied,Often,Happy,Fair management. Good team. Safety is prioritized.,Logistics,Citrusdal Pack House,Warehouse Worker,Permanent,79
365,2024-11,Rarely supported,Dissatisfied,Often,Very unhappy,Poor communication. Safety concerns. Poor equipment.,Pack House Operations,Ceres Pack House,Sorter,Seasonal,1
368,2024-11,Often supported,Satisfied,Rarely,Happy,Respectful treatment. Clear instructions. Supportive supervisors.,Maintenance,Citrusdal,Maintenance Worker,Permanent,72
369,2024-11,Rarely supported,Dissatisfied,Often,Unhappy,Low wages. Too much overtime. Long hours.,Pack House Operations,Ceres Pack House,Packer,Seasonal,1
371,2024-11,Sometimes supported,Neutral,Often,Very unhappy,Fair pay. Opportunities to learn. Weather challenges. Safety concerns.,Grape Production,Upington,Vineyard Supervisor,Seasonal,2
372,2024-11,Often supported,Satisfied,Rarely,Neutral,Good communication. Opportunities to learn. Good team. Long hours.,Maintenance,Upington,Equipment Technician,Permanent,49
373,2024-11,Sometimes supported,Neutral,Sometimes,Happy,Opportunities to learn. Fair pay. Too much overtime. Unfair treatment.,Logistics,Ceres Pack House,Logistics Supervisor,Permanent,107
376,2024-11,Often supported,Satisfied,Sometimes,Neutral,Respectful treatment. Regular breaks. Fair pay.,Maize Production,Graaff-Reinet,Crop Specialist,Permanent,6
377,2024-11,Often supported,Satisfied,Sometimes,Happy,Clear instructions. Fair pay. Good team.,Administration,Graaff-Reinet,Office Manager,Permanent,159
380,2024-11,Sometimes supported,Neutral,Rarely,Happy,Proper equipment provided. Good working environment. Unfair treatment. Inadequate breaks.,Maintenance,Citrusdal,Equipment Technician,Permanent,9
385,2024-11,Often supported,Satisfied,Never,Happy,Regular breaks. Opportunities to learn. Clear instructions. Long hours.,Maintenance,Graaff-Reinet,Equipment Technician,Permanent,125
388,2024-11,Sometimes supported,Neutral,Sometimes,Neutral,Good team. Opportunities to learn. Unfair treatment. Inadequate breaks.,Administration,Ceres,Data Entry Clerk,Permanent,154
389,2024-11,Often supported,Satisfied,Sometimes,Neutral,Fair management. Respectful treatment. Safety is prioritized.,Administration,Graaff-Reinet,Data Entry Clerk,Permanent,24
391,2024-11,Sometimes supported,Neutral,Sometimes,Neutral,Opportunities to learn. Respectful treatment. Weather challenges. Low wages.,Logistics,Graaff-Reinet,Driver,Permanent,1
395,2024-11,Sometimes supported,Neutral,Sometimes,Neutral,Fair management. Good team. Unfair treatment. Housing problems.,Administration,Graaff-Reinet,Payroll Officer,Permanent,3
396,2024-11,Sometimes supported,Neutral,Sometimes,Neutral,Fair pay. Respectful treatment. Too much overtime. Low wages.,Maintenance,Dullstroom,Maintenance Supervisor,Permanent,18
398,2024-11,Sometimes supported,Neutral,Sometimes,Neutral,Respectful treatment. Fair pay. Poor equipment. Too much overtime.,Citrus Production,Citrusdal,Irrigation Specialist,Permanent,117
401,2024-11,Often supported,Satisfied,Rarely,Neutral,Fair pay. Good team. Proper equipment provided.,Maintenance,Dullstroom,Electrician,Permanent,37
402,2024-11,Sometimes supported,Neutral,Sometimes,Neutral,Respectful treatment. Good team. Housing problems. Safety concerns.,Cattle Farming,Dullstroom,Cattle Herder,Permanent,178
404,2024-11,Rarely supported,Dissatisfied,Often,Unhappy,Low wages. Safety concerns. Long hours. Opportunities to learn.,Grape Production,Upington,Harvester,Seasonal,2
406,2024-11,Often supported,Satisfied,Rarely,Happy,Good team. Fair pay. Opportunities to learn.,Pack House Operations,Citrusdal Pack House,Floor Supervisor,Permanent,130
407,2024-11,Rarely supported,Dissatisfied,Sometimes,Neutral,Poor communication. Heavy workload. Housing problems.,Pack House Operations,Citrusdal Pack House,Logistics Coordinator,Contract,34
408,2024-11,Often supported,Satisfied,Never,Happy,Good communication. Respectful treatment. Proper equipment provided. Low wages.,Maintenance,Citrusdal,Equipment Technician,Permanent,169
410,2024-11,Sometimes supported,Neutral,Sometimes,Happy,Good working environment. Good communication. Low wages. Housing problems.,Maintenance,Ceres,Mechanic,Permanent,137
411,2024-11,Often supported,Satisfied,Never,Very happy,Fair management. Regular breaks. Good team.,Logistics,Citrusdal Pack House,Forklift Operator,Permanent,107
413,2024-11,Often supported,Satisfied,Rarely,Neutral,Fair management. Safety is prioritized. Good team.,Cattle Farming,Dullstroom,Milking Technician,Permanent,103
414,2024-11,Sometimes supported,Neutral,Rarely,Happy,Fair pay. Opportunities to learn. Inadequate breaks. Heavy workload.,Pack House Operations,Ceres Pack House,Machine Operator,Permanent,114
416,2024-11,Sometimes supported,Neutral,Sometimes,Neutral,Clear instructions. Regular breaks. Weather challenges. Transportation issues.,Logistics,Upington,Driver,Permanent,97
417,2024-11,Sometimes supported,Neutral,Rarely,Unhappy,Safety is prioritized. Fair pay. Weather challenges. Poor equipment.,Maintenance,Citrusdal Pack House,Mechanic,Permanent,29
418,2024-11,Sometimes supported,Neutral,Often,Unhappy,Good communication. Good working environment. Low wages. Transportation issues.,Maintenance,Citrusdal Pack House,Equipment Technician,Permanent,65
420,2024-11,Often supported,Satisfied,Rarely,Happy,Supportive supervisors. Opportunities to learn. Safety is prioritized. Low wages.,Logistics,Upington,Dispatcher,Permanent,168
431,2024-11,Sometimes supported,Neutral,Sometimes,Happy,Supportive supervisors. Clear instructions. Long hours. Unfair treatment.,Logistics,Upington,Dispatcher,Contract,27
436,2024-11,Sometimes supported,Neutral,Rarely,Unhappy,Regular breaks. Safety is prioritized. Low wages. Long hours.,Logistics,Ceres Pack House,Dispatcher,Contract,6
438,2024-11,Sometimes supported,Neutral,Sometimes,Neutral,Proper equipment provided. Fair pay. Inadequate breaks. Housing problems.,Cattle Farming,Dullstroom,Milking Technician,Permanent,124
439,2024-11,Sometimes supported,Neutral,Often,Happy,Respectful treatment. Fair management. Low wages. Weather challenges.,Maintenance,Dullstroom,Maintenance Supervisor,Permanent,64
444,2024-11,Sometimes supported,Neutral,Sometimes,Neutral,Proper equipment provided. Safety is prioritized. Poor communication. Transportation issues.,Administration,Dullstroom,HR Assistant,Permanent,6
445,2024-11,Often supported,Satisfied,Sometimes,Neutral,Respectful treatment. Good communication. Opportunities to learn.,Maintenance,Upington,Maintenance Supervisor,Permanent,42
450,2024-11,Sometimes supported,Neutral,Rarely,Neutral,Safety is prioritized. Regular breaks. Unfair treatment. Poor communication.,Administration,Graaff-Reinet,Office Manager,Permanent,82
451,2024-11,Always supported,Very satisfied,Rarely,Happy,Good team. Good communication. Proper equipment provided.,Administration,Graaff-Reinet,Payroll Officer,Permanent,67
452,2024-11,Sometimes supported,Neutral,Sometimes,Neutral,Fair management. Proper equipment provided. Transportation issues. Inadequate breaks.,Maintenance,Dullstroom,Mechanic,Permanent,114
457,2024-11,Sometimes supported,Neutral,Sometimes,Very happy,Fair pay. Regular breaks. Housing problems. Poor communication.,Administration,Graaff-Reinet,Office Manager,Permanent,174
461,2024-11,Often supported,Satisfied,Rarely,Happy,Proper equipment provided. Good working environment. Good communication.,Administration,Citrusdal Pack House,Payroll Officer,Permanent,26
462,2024-11,Often supported,Satisfied,Rarely,Very happy,Clear instructions. Opportunities to learn. Fair pay.,Maintenance,Upington,Maintenance Supervisor,Permanent,100
464,2024-11,Often supported,Satisfied,Never,Happy,Safety is prioritized. Clear instructions. Good communication.,Maintenance,Dullstroom,Equipment Technician,Permanent,152
466,2024-11,Sometimes supported,Neutral,Sometimes,Neutral,Supportive supervisors. Clear instructions. Too much overtime. Poor equipment.,Maintenance,Dullstroom,Maintenance Supervisor,Contract,36
469,2024-11,Sometimes supported,Neutral,Sometimes,Happy,Fair management. Regular breaks. Unfair treatment. Transportation issues.,Administration,Citrusdal,Office Manager,Permanent,119
470,2024-11,Often supported,Satisfied,Sometimes,Very happy,Good working environment. Good team. Respectful treatment.,Maintenance,Dullstroom,Maintenance Supervisor,Permanent,102
472,2024-11,Sometimes supported,Neutral,Sometimes,Neutral,Fair management. Respectful treatment. Unfair treatment. Low wages.,Pack House Operations,Ceres,Floor Supervisor,Permanent,46
